agency,title,year,url
"Administration, Department of",State Building Commission Fund March 2023,Fiscal Year 2023,http://www.wvlegislature.gov/legisdocs/reports/agency/A02_FY_2023_15968.pdf
"Environmental Protection, Department of ",Fund 3327 3rd qtr Report for Water Quality Management for FY2023,Fiscal Year 2023,http://www.wvlegislature.gov/legisdocs/reports/agency/E05_FY_2023_15970.pdf
Lottery Commission ,Monthly Report on Lottery Operations March 2023,Fiscal Year 2023,http://www.wvlegislature.gov/legisdocs/reports/agency/L04_FY_2023_15967.pdf
"Protective Services, Division of ",Monthly Status Report,Calendar Year 2023,http://www.wvlegislature.gov/legisdocs/reports/agency/P06_CY_2023_15971.pdf
Workforce WV,Monthly Status Rpt for the Joint Committee on Govt & Finance,Fiscal Year 2023,http://www.wvlegislature.gov/legisdocs/reports/agency/W13_FY_2023_15969.pdf
